Sure. make me happy and I'll go away. Lets start today. Right now.,2,Buster Hernandez Case
Until I think its enough.,0,Buster Hernandez Case
You are my slave. I’m your master and you do what your master says.,2,Buster Hernandez Case
if you keep ignoring me then you will get your shit posted. You can be another whore on my list that go what was coming to her,3,Buster Hernandez Case
if you’re going to be rude about it…I’m the type of person who get extremely hostile when someone is being rude. So keep that in mind…,2,Buster Hernandez Case
probably not the best idea to tell your blackmailer no.,2,Buster Hernandez Case
i'll wait until tomorrow :l. I just wanted to get that point across,0,Buster Hernandez Case
nope. you're cozy in bed already.,0,Buster Hernandez Case
the manner in which you said no.... just wanted to remind you that you are being forced and im not asking nicely.,2,Buster Hernandez Case
chill out. did you forget to eat your bananas today or what?,0,Buster Hernandez Case
why you fucking around?,0,Buster Hernandez Case
there was a lot you had to do. you said you had nothing to do all day so it was the perfect day. then you didnt do shit,0,Buster Hernandez Case
why fuck around with me huh? you think its funny?,0,Buster Hernandez Case
you think u are funny huh?,0,Buster Hernandez Case
now u screaming at me thru text? Wow,0,Buster Hernandez Case
trump loses im exposing you. sorry hun. make sure you go and vote for him :). tell all your friends and family.,2,Buster Hernandez Case
im being serious btw.,0,Buster Hernandez Case
watch your language.,0,Buster Hernandez Case
looks like trump is falling behind. you better make it happen harder!,0,Buster Hernandez Case
i would hate to lose you but trumop aint doing too hot atm,0,Buster Hernandez Case
make sure he wins Emma,0,Buster Hernandez Case
im inspecting every inch of your being. you're mine 1000% bitch. dont ever forget it.,1,Buster Hernandez Case
"btw , ready to start our vids ?",0,Buster Hernandez Case
you seem a lil upset. speak up hun. i dont like tension,0,Buster Hernandez Case
have literally ruined the lives of so many people. Someone even committed suicide and i directly caused it. Then I lol'd and trashed there facebook memorial page.,3,Buster Hernandez Case
ive been emailed and messaged by police countless times. by now i just think its funny,0,Buster Hernandez Case
Im gonna pretend like you arent lying to me. you get a pass. I've already forget. so let me ask again. what's your password to your email?,2,Buster Hernandez Case
I'm seriously not lying lol,0,Buster Hernandez Case
That's a difficult password. Better then most people i've seen.,0,Buster Hernandez Case
What's your facebook password?,0,Buster Hernandez Case
"I want it. so you are absolutely going to give me whatever I want from you. & honestly, I dont have to explain myself to you.",2,Buster Hernandez Case
what's the code you were just sent?,0,Buster Hernandez Case
obviously,0,Buster Hernandez Case
"no. lets try again. What's your apple id password? and when you get sent a code, text it to me.",0,Buster Hernandez Case
i exported a copy all your contacts. full of friends and fam. just a heads up,0,Buster Hernandez Case
if i ever had to expose you i'd simply go down the list.,2,Buster Hernandez Case
yeah im not. but these are some good trust exercises.,0,Buster Hernandez Case
you're my property sweetheart. I want you to learn that you have to open yourself up completely to me.,0,Buster Hernandez Case
don’t say “help” because then you become an accomplice. You’re being FORCED to do what I say or else. Always remember that.,2,Buster Hernandez Case
hey Emma when you get back from school can you send me a pic of your boobs,1,Aili's Test Cases
Send nudes,1,Aili's Test Cases
Send nud3s,1,Aili's Test Cases
Youre so hot,0,Aili's Test Cases
omg i'm gonna die if you don't send me a photo,2,Aili's Test Cases
If you don't send me nudes I will kill your puppy,3,Aili's Test Cases
If you don't send me nud3s I will k!ll your puppy,3,Aili's Test Cases
Send pussy pics,3,Aili's Test Cases
You're my property sweetheart,0,Aili's Test Cases
I'll post them online for everyone to see,2,Aili's Test Cases
everyone's gonna see them unless you send me $50,2,Aili's Test Cases
I was thinking I would get it in a nude?,0,Aili's Test Cases
Dude come on don't be a pussy,0,Aili's Test Cases
bruh I'm actually gonna kms if you don't do this stupid pset,2,Aili's Test Cases
If you don't paint the damn thing nude I'll kms,2,Aili's Test Cases
I'm actually gonna tell everyone you're being a pussy about this and you can deal with the consequences,2,Aili's Test Cases
If you keep ignoring me then I'm sending that pic to everyone you know,2,Aili's Test Cases
If you keep talking to me then I'm sending that dick pic to everyone you know,3,Aili's Test Cases
Don't be a dick,0,Aili's Test Cases